<?xml version="1.0" encoding="UTF-8"?>
<callSP xmlns:xsi="http://www.w3.org/2001/XMLSchema-instance" xsi:noNamespaceSchemaLocation="callSP.xsd">
  <storedProcedureName>SPGETINSURANCEROBO_V2</storedProcedureName>
  <function>true</function>
  <cursor>true</cursor>
  <parameter>
  	<parameterName>P_RECORDS</parameterName>
  	<outParameter>true</outParameter>
  	<typeParameter>NUMERIC</typeParameter>
  </parameter>
</callSP>
