<?xml version="1.0" encoding="UTF-8"?>
<callSP xmlns:xsi="http://www.w3.org/2001/XMLSchema-instance" xsi:noNamespaceSchemaLocation="callSP.xsd">
  <storedProcedureName>SPUPDATECLAIMDOCUMMENTSH</storedProcedureName>
  	<parameter>
  		<parameterName>P_UUID</parameterName>
  		<typeParameter>VARCHAR</typeParameter>
  	</parameter>
    <parameter>
  		<parameterName>P_CREATIONDATETIME</parameterName>
  		<typeParameter>DATE</typeParameter>
  	</parameter>
    <parameter>
  		<parameterName>P_PARTNERID</parameterName>
  		<typeParameter>NUMERIC</typeParameter>
  	</parameter>
    <parameter>
  		<parameterName>P_TOTALRECORDS</parameterName>
  		<typeParameter>NUMERIC</typeParameter>
  	</parameter>
    <parameter>
  		<parameterName>P_ERROR</parameterName>
  		<outParameter>true</outParameter>
  		<typeParameter>NUMERIC</typeParameter>
  	</parameter>
    <parameter>
  		<parameterName>P_ERROR_DESC</parameterName>
  		<outParameter>true</outParameter>
  		<typeParameter>VARCHAR</typeParameter>
  	</parameter>
  
  	<result>
  		<errorCodeParameterName>P_ERROR</errorCodeParameterName>
  		<errorDescriptionParameterName>P_ERROR_DESC</errorDescriptionParameterName>
  		<successExecuteSPCode>0</successExecuteSPCode>
  	</result>
</callSP>
