<?xml version="1.0" encoding="UTF-8"?>
<callSP xmlns:xsi="http://www.w3.org/2001/XMLSchema-instance" xsi:noNamespaceSchemaLocation="callSP.xsd">
  <storedProcedureName>SPGETINSURANCE</storedProcedureName>
  <function>true</function>
  <cursor>true</cursor>
  
  <parameter>
  	<parameterName>P_INSURANCEID</parameterName>
  	<typeParameter>VARCHAR</typeParameter>
  </parameter>
  
   <parameter>
  	<parameterName>P_PRODUCTID</parameterName>
  	<typeParameter>VARCHAR</typeParameter>
  </parameter>
  
   <parameter>
  	<parameterName>P_GIVENNAME</parameterName>
  	<typeParameter>VARCHAR</typeParameter>
  </parameter>
  
  <parameter>
  	<parameterName>P_FAMILYNAME</parameterName>
  	<typeParameter>VARCHAR</typeParameter>
  </parameter>
  
   <parameter>
  	<parameterName>P_MIDDLENAME</parameterName>
  	<typeParameter>VARCHAR</typeParameter>
  </parameter>
  
   <parameter>
  	<parameterName>P_ADDITIONALFAMILYNAME</parameterName>
  	<typeParameter>VARCHAR</typeParameter>
  </parameter>
  
    <parameter>
  	<parameterName>P_BIRTHDATE</parameterName>
  	<typeParameter>DATE</typeParameter>
  </parameter>
  
   <parameter>
  	<parameterName>P_CERTIFICATE</parameterName>
  	<typeParameter>VARCHAR</typeParameter>
  </parameter>
  
  <parameter>
  	<parameterName>P_BUSINESSPARTNERID</parameterName>
  	<typeParameter>VARCHAR</typeParameter>
  </parameter>
  
  <parameter>
  	<parameterName>P_PARTNERID</parameterName>
  	<typeParameter>NUMERIC</typeParameter>
  </parameter>
  
 
</callSP>
