<?xml version="1.0" encoding="UTF-8"?>
<callSP xmlns:xsi="http://www.w3.org/2001/XMLSchema-instance" xsi:noNamespaceSchemaLocation="callSP.xsd">
  <storedProcedureName>GETAMOUNTTOPAY</storedProcedureName>
  <function>true</function>
  <cursor>true</cursor>
  <parameter>
  	<parameterName>P_INSURANCEID</parameterName>
  	<typeParameter>VARCHAR</typeParameter>
  </parameter>
   <parameter>
  	<parameterName>P_BUSINESSPARTNERID</parameterName>
  	<typeParameter>VARCHAR</typeParameter>
  </parameter>
   <parameter>
  	<parameterName>P_PRODUCTID</parameterName>
  	<typeParameter>VARCHAR</typeParameter>
  </parameter>
   <parameter>
  	<parameterName>P_COVERAGEID</parameterName>
  	<typeParameter>NUMERIC</typeParameter>
  </parameter>
  
  <parameter>
  	<parameterName>P_FLAGCOVERAGE</parameterName>
  	<typeParameter>NUMERIC</typeParameter>
  </parameter>
  
  <parameter>
  	<parameterName>P_CLAIMDAYS</parameterName>
  	<typeParameter>NUMERIC</typeParameter>
  </parameter>
  
  <parameter>
  	<parameterName>P_INITIAL_DATE</parameterName>
  	<typeParameter>DATE</typeParameter>
  </parameter>
  
    <parameter>
  	<parameterName>P_END_DATE</parameterName>
  	<typeParameter>DATE</typeParameter>
  </parameter>
  
    <parameter>
  	<parameterName>P_PARTNERID</parameterName>
  	<typeParameter>NUMERIC</typeParameter>
  </parameter>
  
   <parameter>
  	<parameterName>P_REMAINING</parameterName>
  		<outParameter>true</outParameter>
  	<typeParameter>NUMERIC</typeParameter>
  </parameter>
  
   <parameter>
  	<parameterName>P_CALCDAYS</parameterName>
  		<outParameter>true</outParameter>
  	<typeParameter>NUMERIC</typeParameter>
  </parameter>
  
   <parameter>
  	<parameterName>P_ERROR</parameterName>
  		<outParameter>true</outParameter>
  	<typeParameter>NUMERIC</typeParameter>
  </parameter>
    <parameter>
  	<parameterName>P_ERROR_DESC</parameterName>
  		<outParameter>true</outParameter>
  	<typeParameter>VARCHAR</typeParameter>
  </parameter>
  
</callSP>
