<?xml version="1.0" encoding="UTF-8"?>
<callSP xmlns:xsi="http://www.w3.org/2001/XMLSchema-instance"
	xsi:noNamespaceSchemaLocation="callSP.xsd">
	<storedProcedureName>SPBENEFICIARYDATAUPDATE</storedProcedureName>
	<parameter>
		<parameterName>P_INSURANCEID</parameterName>
		<typeParameter>VARCHAR</typeParameter>
	</parameter>
	<parameter>
		<parameterName>P_BENEFICIARYID</parameterName>
		<typeParameter>VARCHAR</typeParameter>
	</parameter>

	<parameter>
		<parameterName>P_PERCENTAGE</parameterName>
		<typeParameter>NUMERIC</typeParameter>
	</parameter>
	<parameter>
		<parameterName>P_RELATIONSHIP</parameterName>
		<typeParameter>VARCHAR</typeParameter>
	</parameter>

	<parameter>
		<parameterName>P_GIVENNAME</parameterName>
		<typeParameter>VARCHAR</typeParameter>
	</parameter>
	<parameter>
		<parameterName>P_MIDDLENAME</parameterName>
		<typeParameter>VARCHAR</typeParameter>
	</parameter>

	<parameter>
		<parameterName>P_FAMILYNAME</parameterName>
		<typeParameter>VARCHAR</typeParameter>
	</parameter>
	<parameter>
		<parameterName>P_ADDITIONALFAMILYNAME</parameterName>
		<typeParameter>VARCHAR</typeParameter>
	</parameter>


	<parameter>
		<parameterName>P_BIRTHDATE</parameterName>
		<typeParameter>DATE</typeParameter>
	</parameter>
	<parameter>
		<parameterName>P_GENDER</parameterName>
		<typeParameter>VARCHAR</typeParameter>
	</parameter>

	<parameter>
		<parameterName>P_HOMEPHONE</parameterName>
		<typeParameter>VARCHAR</typeParameter>
	</parameter>

	<parameter>
		<parameterName>P_OFFICEPHONE</parameterName>
		<typeParameter>VARCHAR</typeParameter>
	</parameter>

	<parameter>
		<parameterName>P_CELLPHONE</parameterName>
		<typeParameter>VARCHAR</typeParameter>
	</parameter>

	<parameter>
		<parameterName>P_MARRIEDFAMILYNAME</parameterName>
		<typeParameter>VARCHAR</typeParameter>
	</parameter>

	<parameter>
		<parameterName>P_PARTNERID</parameterName>
		<typeParameter>NUMERIC</typeParameter>
	</parameter>


	<parameter>
		<parameterName>P_ERROR</parameterName>
		<outParameter>true</outParameter>
		<typeParameter>NUMERIC</typeParameter>
	</parameter>
	<parameter>
		<parameterName>P_ERROR_DESC</parameterName>
		<outParameter>true</outParameter>
		<typeParameter>VARCHAR</typeParameter>
	</parameter>

</callSP>
