<?xml version="1.0" encoding="UTF-8"?>
<callSP xmlns:xsi="http://www.w3.org/2001/XMLSchema-instance"
	xsi:noNamespaceSchemaLocation="callSP.xsd">
	<storedProcedureName>SPTINVOICEREPORT</storedProcedureName>
	<cursor>true</cursor>


	<parameter>
		<parameterName>P_SOCIO</parameterName>
		<typeParameter>NUMERIC</typeParameter>
	</parameter>

	<parameter>
		<parameterName>P_PRODUCTO</parameterName>
		<typeParameter>VARCHAR</typeParameter>
	</parameter>

	<parameter>
		<parameterName>P_REGISTER</parameterName>
		<typeParameter>VARCHAR</typeParameter>
	</parameter>


	<parameter>
		<parameterName>P_MODEID</parameterName>
		<typeParameter>VARCHAR</typeParameter>
	</parameter>

	<parameter>
		<parameterName>P_STARTDATE</parameterName>
		<typeParameter>DATE</typeParameter>
	</parameter>


	<parameter>
		<parameterName>P_ENDDATE</parameterName>
		<typeParameter>DATE</typeParameter>
	</parameter>




	<parameter>
		<parameterName>P_TOT_REG</parameterName>
		<outParameter>true</outParameter>
		<typeParameter>NUMERIC</typeParameter>
	</parameter>


	<parameter>
		<parameterName>P_TYPE</parameterName>
		<outParameter>true</outParameter>
		<typeParameter>NUMERIC</typeParameter>
	</parameter>

	<parameter>
		<parameterName>P_TYPE_DESCRIPTION</parameterName>
		<outParameter>true</outParameter>
		<typeParameter>VARCHAR</typeParameter>
	</parameter>

	<parameter>
		<parameterName>P_TOT_REGN</parameterName>
		<outParameter>true</outParameter>
		<typeParameter>NUMERIC</typeParameter>
	</parameter>

	<parameter>
		<parameterName>P_TYPEN</parameterName>
		<outParameter>true</outParameter>
		<typeParameter>NUMERIC</typeParameter>
	</parameter>

	<parameter>
		<parameterName>P_TYPE_DESCRIPTIONN</parameterName>
		<outParameter>true</outParameter>
		<typeParameter>VARCHAR</typeParameter>
	</parameter>

</callSP>