<?xml version="1.0" encoding="UTF-8"?>
<callSP xmlns:xsi="http://www.w3.org/2001/XMLSchema-instance" xsi:noNamespaceSchemaLocation="callSP.xsd">
  <storedProcedureName>SPSEARCHCOVERAGEDOCUMENTS</storedProcedureName>
  <function>true</function>
  <cursor>true</cursor>
  
  
  <parameter>
  	<parameterName>P_COVERAGECATALOGUEID</parameterName>
  	<typeParameter>VARCHAR</typeParameter>
  </parameter>
  <parameter>
  	<parameterName>P_RELATIONSHIPCODE</parameterName>
  	<typeParameter>VARCHAR</typeParameter>
  </parameter>

</callSP>
