<?xml version="1.0" encoding="UTF-8"?>
<callSP xmlns:xsi="http://www.w3.org/2001/XMLSchema-instance"
	xsi:noNamespaceSchemaLocation="callSP.xsd">
	<storedProcedureName>SPCREATEUPDATEMEDICO</storedProcedureName>

	<parameter>
		<parameterName>P_ID_MEDICO</parameterName>
		<typeParameter>NUMERIC</typeParameter>
	</parameter>

	<parameter>
		<parameterName>P_CEDULA</parameterName>
		<typeParameter>VARCHAR</typeParameter>
	</parameter>

	<parameter>
		<parameterName>P_GIVENNAME</parameterName>
		<typeParameter>VARCHAR</typeParameter>
	</parameter>

	<parameter>
		<parameterName>P_MIDDLENAME</parameterName>
		<typeParameter>VARCHAR</typeParameter>
	</parameter>

	<parameter>
		<parameterName>P_FAMILYNAME</parameterName>
		<typeParameter>VARCHAR</typeParameter>
	</parameter>

	<parameter>
		<parameterName>P_ADDITIONALFAMILYNAME</parameterName>
		<typeParameter>VARCHAR</typeParameter>
	</parameter>

	<parameter>
		<parameterName>P_ESPECIALIDAD</parameterName>
		<typeParameter>VARCHAR</typeParameter>
	</parameter>

	<parameter>
		<parameterName>P_STATUS</parameterName>
		<typeParameter>VARCHAR</typeParameter>
	</parameter>
	
	<parameter>
		<parameterName>P_USER</parameterName>
		<typeParameter>VARCHAR</typeParameter>
	</parameter>

	<parameter>
		<parameterName>P_PARTNERID</parameterName>
		<typeParameter>NUMERIC</typeParameter>
	</parameter>

	<parameter>
		<parameterName>P_ERROR</parameterName>
		<outParameter>true</outParameter>
		<typeParameter>NUMERIC</typeParameter>
	</parameter>

	<parameter>
		<parameterName>P_ERROR_DESC</parameterName>
		<outParameter>true</outParameter>
		<typeParameter>VARCHAR</typeParameter>
	</parameter>
</callSP>
