<?xml version="1.0" encoding="UTF-8"?>
<callSP xmlns:xsi="http://www.w3.org/2001/XMLSchema-instance"
	xsi:noNamespaceSchemaLocation="callSP.xsd">
	<storedProcedureName>FNGETCLIENTES</storedProcedureName>
	
	<function>true</function>
	<cursor>true</cursor>
	
	<parameter>
		<parameterName>P_BUSINESSPARTNERID</parameterName>
		<typeParameter>VARCHAR</typeParameter>
	</parameter>
	<parameter>
		<parameterName>P_BUSINESSPARTNERNAME</parameterName>
		<typeParameter>VARCHAR</typeParameter>
	</parameter>
	<parameter>
		<parameterName>P_BIRTHDATE</parameterName>
		<typeParameter>DATE</typeParameter>
	</parameter>
	<parameter>
		<parameterName>P_PARTNERID</parameterName>
		<typeParameter>NUMERIC</typeParameter>
	</parameter>

</callSP>
