<?xml version="1.0" encoding="UTF-8"?>
<callSP xmlns:xsi="http://www.w3.org/2001/XMLSchema-instance" xsi:noNamespaceSchemaLocation="callSP.xsd">
  <storedProcedureName>SPUPDATEIMPARAMETERS</storedProcedureName>
  
  <parameter>
		<parameterName>P_PARAM_ID</parameterName>
		<typeParameter>NUMERIC</typeParameter>
	</parameter>

	<parameter>
		<parameterName>P_MAX_DIAS</parameterName>
		<typeParameter>NUMERIC</typeParameter>
	</parameter>

	<parameter>
		<parameterName>P_MAX_SINIESTROS</parameterName>
		<typeParameter>NUMERIC</typeParameter>
	</parameter>

	<parameter>
		<parameterName>P_USER</parameterName>
		<typeParameter>VARCHAR</typeParameter>
	</parameter>

	<parameter>
		<parameterName>P_PARTNERID</parameterName>
		<typeParameter>NUMERIC</typeParameter>
	</parameter>

	<parameter>
		<parameterName>P_ERROR</parameterName>
		<outParameter>true</outParameter>
		<typeParameter>NUMERIC</typeParameter>
	</parameter>

	<parameter>
		<parameterName>P_ERROR_DESC</parameterName>
		<outParameter>true</outParameter>
		<typeParameter>VARCHAR</typeParameter>
	</parameter>
</callSP>
